{"@context":"../../ontology/ecl-context.jsonld","iri":"ecl:PERSON-CMR-MARTINEZ-ZOGO","id":"PERSON-CMR-MARTINEZ-ZOGO","type":"Person","name":"Martinez Zogo","aliases":[],"dossier":"../../dossiers/persons/CMR-MARTINEZ-ZOGO.md","lastSubstantiveReview":"2026-08-28","reviewDue":"2026-09-28","reviewClass":"active","reviewReason":"Identity-only person named in the canonical State dossier; preserves subject-of-record provenance without inferring culpability, participation, protected status or any ECL governance outcome."}
