{
  "@context": "../../ontology/ecl-context.jsonld",
  "iri": "ecl:STATE-SLB",
  "id": "STATE-SLB",
  "type": "State",
  "name": "Solomon Islands",
  "iso3": "SLB",
  "aliases": [
    "SLB"
  ],
  "dossier": "../../dossiers/states/SLB.md",
  "publicReviewIssue": "https://github.com/Papishushi/exergic-commons-license/issues/160",
  "lastSubstantiveReview": "2026-08-13",
  "reviewDue": "2026-11-11",
  "reviewClass": "manual"
}
