{
  "@context": "../../ontology/ecl-context.jsonld",
  "iri": "ecl:ORG-HAMAS",
  "id": "ORG-HAMAS",
  "type": "Organization",
  "name": "Hamas",
  "dossier": "../../dossiers/organizations/HAMAS.md",
  "lastSubstantiveReview": "2026-08-13",
  "reviewClass": "manual",
  "reviewReason": "Canonical non-State identity from the 2026 cross-entity reconciliation cohort; governance remains in the dossier and review procedure."
}
