{
  "@context": "../../ontology/ecl-context.jsonld",
  "iri": "ex:ORG-CANDIRU",
  "id": "ORG-CANDIRU",
  "type": "Organization",
  "name": "Candiru",
  "dossier": "../../dossiers/organizations/CANDIRU.md",
  "lastSubstantiveReview": "2026-08-13",
  "reviewClass": "manual",
  "reviewReason": "Canonical non-State identity from the 2026 cross-entity reconciliation cohort; governance remains in the dossier and review procedure."
}
