{
  "@context": "../../ontology/ecl-context.jsonld",
  "iri": "ecl:STATE-NLD",
  "id": "STATE-NLD",
  "type": "State",
  "name": "Netherlands",
  "aliases": ["NLD", "The Netherlands"],
  "dossier": "../../dossiers/states/NLD.md",
  "lastSubstantiveReview": "2026-08-14",
  "reviewDue": "2026-09-14",
  "reviewClass": "active",
  "reviewReason": "Narrow algorithmic finding is remediation-sensitive and the formal pilot is uncertainty-sensitive.",
  "trackedObjects": ["ecl:PROJECT-NLD-PROBATION-RISK-TOOLS"],
  "monitorIds": []
}
