{
  "@context": "../../ontology/ecl-context.jsonld",
  "iri": "ecl:STATE-BFA",
  "id": "STATE-BFA",
  "type": "State",
  "name": "Burkina Faso",
  "iso3": "BFA",
  "aliases": [
    "BFA"
  ],
  "dossier": "../../dossiers/states/BFA.md",
  "publicReviewIssue": "https://github.com/Papishushi/exergic-commons-license/issues/27",
  "lastSubstantiveReview": "2026-08-11",
  "reviewClass": "manual"
}
