{"@context":"../../ontology/ecl-context.jsonld","iri":"ecl:PERSON-GNQ-JOAQUIN-ELO-AYETO","id":"PERSON-GNQ-JOAQUIN-ELO-AYETO","type":"Person","name":"Joaquín Elo Ayeto","aliases":[],"dossier":"../../dossiers/persons/GNQ-JOAQUIN-ELO-AYETO.md","lastSubstantiveReview":"2026-08-28","reviewDue":"2026-09-28","reviewClass":"active","reviewReason":"Identity-only person named in the canonical State dossier; preserves subject-of-record provenance without inferring culpability, participation, protected status or any ECL governance outcome."}
