{
  "@context": "../../ontology/ecl-context.jsonld",
  "iri": "ex:STATE-SYC",
  "id": "STATE-SYC",
  "type": "State",
  "name": "Seychelles",
  "iso3": "SYC",
  "aliases": [
    "SYC"
  ],
  "dossier": "../../dossiers/states/SYC.md",
  "publicReviewIssue": "https://github.com/Papishushi/exergic-commons-license/issues/155",
  "lastSubstantiveReview": "2026-08-13",
  "reviewClass": "manual"
}
