{"@context":"../../ontology/ecl-context.jsonld","iri":"ecl:ORG-BINUH","id":"ORG-BINUH","type":"Organization","name":"BINUH","aliases":[],"dossier":"../../dossiers/organizations/BINUH.md","lastSubstantiveReview":"2026-08-18","reviewDue":"2026-09-18","reviewClass":"active","reviewReason":"Identity-only UN mission/office referenced as attribution provenance; exact report locator gaps remain proposition-specific."}
