{"@context":"../../ontology/ecl-context.jsonld","iri":"ecl:INSTITUTION-BIH-CONSTITUTIONAL-COURT","id":"INSTITUTION-BIH-CONSTITUTIONAL-COURT","type":"Institution","name":"Constitutional Court of Bosnia and Herzegovina","aliases":["Constitutional Court"],"dossier":"../../dossiers/institutions/BIH-CONSTITUTIONAL-COURT.md","lastSubstantiveReview":"2026-08-18","reviewDue":"2026-09-18","reviewClass":"active","reviewReason":"Identity-only national constitutional court credited as a rights-guarantor/counter-institution in the Bosnia and Herzegovina dossier; no governance or effectiveness inference follows from identity."}
