{
  "@context": "../../ontology/ecl-context.jsonld",
  "iri": "ex:STATE-CYP",
  "id": "STATE-CYP",
  "type": "State",
  "name": "Cyprus",
  "iso3": "CYP",
  "aliases": [
    "CYP"
  ],
  "dossier": "../../dossiers/states/CYP.md",
  "publicReviewIssue": "https://github.com/Papishushi/exergic-commons-license/issues/43",
  "lastSubstantiveReview": "2026-08-13",
  "reviewClass": "manual"
}
