{
  "@context": "../../ontology/ecl-context.jsonld",
  "iri": "ecl:PROJECT-ICE-ICM-INVESTIGATIVE-ANALYTICS",
  "id": "PROJECT-ICE-ICM-INVESTIGATIVE-ANALYTICS",
  "type": "Project",
  "name": "ICE Investigative Case Management / Investigative Analytics",
  "aliases": [
    "ICE ICM/IA",
    "Investigative Case Management",
    "Investigative Analytics"
  ],
  "dossier": "../../dossiers/projects/ICE-ICM-INVESTIGATIVE-ANALYTICS.md",
  "lastSubstantiveReview": "2026-08-13",
  "reviewClass": "manual",
  "reviewReason": "Project identity preserves the established semantic ID used by the State pilot and living-update specification; governance remains in the canonical project dossier and review procedure."
}
