{
  "@context": "../../ontology/ecl-context.jsonld",
  "iri": "ex:STATE-PRY",
  "id": "STATE-PRY",
  "type": "State",
  "name": "Paraguay",
  "iso3": "PRY",
  "aliases": [
    "PRY"
  ],
  "dossier": "../../dossiers/states/PRY.md",
  "publicReviewIssue": "https://github.com/Papishushi/exergic-commons-license/issues/136",
  "lastSubstantiveReview": "2026-08-11",
  "reviewClass": "manual"
}
